{
  "schema_version": "RANGEMATCH_BUYER_EVIDENCE_PACKET@0.1.0",
  "parcel": {
    "parcel_id": "ENGINEERING_TEST_GEOMETRY_CPER_001",
    "geometry_hash": "932edc9b3cb36b49b5a8fdd5ffa52cba17874720947865e0916ba069fad5f309",
    "confirmation_status": "CONFIRMED",
    "display_label": "CPER engineering test geometry, Weld County, CO",
    "is_engineering_test_geometry": true
  },
  "decision_context": {
    "current_stage": "PRE_VISIT",
    "decision_deadline": "THIS_WEEK",
    "candidate_actions": [
      "REQUEST_DOCUMENTS",
      "SCHEDULE_FIELD_VISIT",
      "ENGAGE_PROFESSIONAL",
      "PAUSE_ADDITIONAL_SPEND"
    ],
    "user_question": "Should I fly to inspect this parcel this weekend?",
    "goal": "CHOOSE_NEXT_DILIGENCE_SPEND_NOT_PURCHASE"
  },
  "listing_claims": [],
  "observations": [
    {
      "observation_id": "OBS_PRECIP",
      "label": "Mean annual precipitation",
      "value": 345.74,
      "display_value": null,
      "unit": "mm/year",
      "time_period": null,
      "evidence_state": "MEASURED",
      "spatial_meaning": "parcel_aggregate",
      "source_id": "NOAA_NCEI_DIRECT_CLIMATE_NORMALS_NETCDF",
      "land_fact_ref": "VAR_F05_MEAN_ANNUAL_PRECIPITATION",
      "allowed_support": [
        "canonical climate lookup is complete"
      ],
      "prohibited_support": [
        "climate adequacy",
        "drought resilience",
        "future performance"
      ]
    },
    {
      "observation_id": "OBS_SLOPE",
      "label": "Median slope",
      "value": 2.395727249934432,
      "display_value": null,
      "unit": "degree",
      "time_period": null,
      "evidence_state": "PARCEL_DERIVED",
      "spatial_meaning": "parcel_aggregate",
      "source_id": "USGS_3DEP",
      "land_fact_ref": "VAR_F01_SLOPE_MEDIAN_DEGREES",
      "allowed_support": [
        "gentle typical slope context"
      ],
      "prohibited_support": [
        "suitability",
        "traversability for every animal"
      ]
    },
    {
      "observation_id": "OBS_AREA",
      "label": "Mapped geometric area",
      "value": 1404078.7002779155,
      "display_value": null,
      "unit": "m2",
      "time_period": null,
      "evidence_state": "PARCEL_DERIVED",
      "spatial_meaning": "parcel_aggregate",
      "source_id": "CONFIRMED_GEOMETRY",
      "land_fact_ref": "VAR_F06_AREA_M2",
      "allowed_support": [
        "mapped outline size"
      ],
      "prohibited_support": [
        "grazable acres",
        "fencing cost",
        "survey"
      ]
    },
    {
      "observation_id": "OBS_RAP_PROD",
      "label": "Modeled annual herbaceous production",
      "value": 937.6780475452124,
      "display_value": null,
      "unit": "pound_per_acre",
      "time_period": "annual_accumulated_new_growth_2025",
      "evidence_state": "MODELED",
      "spatial_meaning": "parcel_mean",
      "source_id": "RAP_productionV3",
      "land_fact_ref": "VAR_F02_ANNUAL_HERB_PRODUCTION",
      "allowed_support": [
        "modeled vegetation snapshot"
      ],
      "prohibited_support": [
        "available forage",
        "carrying capacity",
        "ready for cattle"
      ]
    },
    {
      "observation_id": "OBS_WATER_COUNT",
      "label": "Mapped hydrography candidate count",
      "value": 9,
      "display_value": null,
      "unit": "count",
      "time_period": null,
      "evidence_state": "MAPPED_CANDIDATE",
      "spatial_meaning": "parcel_aggregate",
      "source_id": "USGS_NHDPLUS_HR",
      "land_fact_ref": "VAR_F03_MAPPED_WATER_CANDIDATE_COUNT",
      "allowed_support": [
        "mapped water features exist as leads"
      ],
      "prohibited_support": [
        "usable livestock water",
        "year-round reliability",
        "legal right"
      ]
    },
    {
      "observation_id": "OBS_ROAD",
      "label": "Nearest mapped road distance",
      "value": 0.0,
      "display_value": null,
      "unit": "m",
      "time_period": null,
      "evidence_state": "MAPPED_CANDIDATE",
      "spatial_meaning": "parcel_aggregate",
      "source_id": "US_CENSUS_TIGER_LINE_2025_ALL_ROADS",
      "land_fact_ref": "VAR_F07_NEAREST_MAPPED_ROAD_DISTANCE_M",
      "allowed_support": [
        "physical road contact on the map"
      ],
      "prohibited_support": [
        "legal access",
        "usable entrance"
      ]
    }
  ],
  "candidate_objects": [
    {
      "candidate_id": "USGS_NHDPLUS_HR:NHDWaterbody:120639594",
      "candidate_type": "WATERBODY",
      "source_feature_type": "NHDWaterbody",
      "source_feature_id": "120639594",
      "display_name": null,
      "geometry": {
        "kind": "BBOX",
        "centroid": null,
        "bbox": [
          -104.76110501420337,
          40.82291046980667,
          -104.75935221384321,
          40.82497260274206
        ],
        "field_navigation_precision": "AREA_ONLY"
      },
      "parcel_relationship": {
        "intersects": true,
        "distance_m": null,
        "relationship_status": "DERIVED"
      },
      "evidence_state": "MAPPED_CANDIDATE",
      "review_status": "SAMPLED",
      "legal_access_status": "NOT_VERIFIED",
      "livestock_use_status": "NOT_VERIFIED",
      "allowed_action_language": [
        "review this waterbody area"
      ],
      "prohibited_inferences": [
        "usable livestock water",
        "water-source point",
        "exact pin",
        "legal access"
      ]
    },
    {
      "candidate_id": "USGS_NHDPLUS_HR:NetworkNHDFlowline:120638829",
      "candidate_type": "FLOWLINE",
      "source_feature_type": "NetworkNHDFlowline",
      "source_feature_id": "120638829",
      "display_name": null,
      "geometry": {
        "kind": "LINE",
        "centroid": null,
        "bbox": [
          -104.76541568070553,
          40.825831802747125,
          -104.76061101406769,
          40.83281027011377
        ],
        "field_navigation_precision": "AREA_ONLY"
      },
      "parcel_relationship": {
        "intersects": true,
        "distance_m": null,
        "relationship_status": "DERIVED"
      },
      "evidence_state": "REMOTELY_SUPPORTED",
      "review_status": "SAMPLED",
      "legal_access_status": "NOT_VERIFIED",
      "livestock_use_status": "NOT_VERIFIED",
      "allowed_action_language": [
        "review this flowline segment as an area"
      ],
      "prohibited_inferences": [
        "usable livestock water",
        "water-source point",
        "exact pin",
        "legal access"
      ]
    },
    {
      "candidate_id": "USGS_NHDPLUS_HR:NetworkNHDFlowline:120638830",
      "candidate_type": "FLOWLINE",
      "source_feature_type": "NetworkNHDFlowline",
      "source_feature_id": "120638830",
      "display_name": "Little Owl Creek",
      "geometry": {
        "kind": "LINE",
        "centroid": null,
        "bbox": [
          -104.76841921402766,
          40.825831802747125,
          -104.76061101406769,
          40.83201466996486
        ],
        "field_navigation_precision": "AREA_ONLY"
      },
      "parcel_relationship": {
        "intersects": true,
        "distance_m": null,
        "relationship_status": "DERIVED"
      },
      "evidence_state": "REMOTELY_SUPPORTED",
      "review_status": "SAMPLED",
      "legal_access_status": "NOT_VERIFIED",
      "livestock_use_status": "NOT_VERIFIED",
      "allowed_action_language": [
        "review this flowline segment as an area"
      ],
      "prohibited_inferences": [
        "usable livestock water",
        "water-source point",
        "exact pin",
        "legal access"
      ]
    },
    {
      "candidate_id": "USGS_NHDPLUS_HR:NetworkNHDFlowline:120638838",
      "candidate_type": "FLOWLINE",
      "source_feature_type": "NetworkNHDFlowline",
      "source_feature_id": "120638838",
      "display_name": "Little Owl Creek",
      "geometry": {
        "kind": "LINE",
        "centroid": null,
        "bbox": [],
        "field_navigation_precision": "NOT_NAVIGABLE"
      },
      "parcel_relationship": {
        "intersects": true,
        "distance_m": null,
        "relationship_status": "DERIVED"
      },
      "evidence_state": "MAPPED_CANDIDATE",
      "review_status": "UNREVIEWED",
      "legal_access_status": "NOT_VERIFIED",
      "livestock_use_status": "NOT_VERIFIED",
      "allowed_action_language": [
        "request a usable location or build a field inventory; this mapped identity cannot be drawn"
      ],
      "prohibited_inferences": [
        "usable livestock water",
        "water-source point",
        "exact pin",
        "legal access"
      ]
    },
    {
      "candidate_id": "USGS_NHDPLUS_HR:NetworkNHDFlowline:120638842",
      "candidate_type": "FLOWLINE",
      "source_feature_type": "NetworkNHDFlowline",
      "source_feature_id": "120638842",
      "display_name": "Little Owl Creek",
      "geometry": {
        "kind": "LINE",
        "centroid": null,
        "bbox": [],
        "field_navigation_precision": "NOT_NAVIGABLE"
      },
      "parcel_relationship": {
        "intersects": true,
        "distance_m": null,
        "relationship_status": "DERIVED"
      },
      "evidence_state": "MAPPED_CANDIDATE",
      "review_status": "UNREVIEWED",
      "legal_access_status": "NOT_VERIFIED",
      "livestock_use_status": "NOT_VERIFIED",
      "allowed_action_language": [
        "request a usable location or build a field inventory; this mapped identity cannot be drawn"
      ],
      "prohibited_inferences": [
        "usable livestock water",
        "water-source point",
        "exact pin",
        "legal access"
      ]
    },
    {
      "candidate_id": "USGS_NHDPLUS_HR:NetworkNHDFlowline:156614082",
      "candidate_type": "FLOWLINE",
      "source_feature_type": "NetworkNHDFlowline",
      "source_feature_id": "156614082",
      "display_name": null,
      "geometry": {
        "kind": "LINE",
        "centroid": null,
        "bbox": [],
        "field_navigation_precision": "NOT_NAVIGABLE"
      },
      "parcel_relationship": {
        "intersects": true,